{
  "bbox_lnglat": [
    -122.317554,
    47.656381,
    -122.311146,
    47.66546
  ],
  "generated_at": "2026-10-17T22:04:01Z",
  "labels": [
    {
      "cluster_size": 1,
      "id": "ps:9000001000",
      "imagery_date": "2019-06",
      "intersection_id": null,
      "label_date": "2019-07",
      "lat": 47.658381,
      "lng": -122.314631,
      "n_agree": 0,
      "n_disagree": 0,
      "n_unsure": 0,
      "osm_way_id": null,
      "severity": 2,
      "source_cluster_id": 9000001000,
      "street_edge_id": null,
      "tags": [],
      "type": "surface_problem"
    },
    {
      "cluster_size": 1,
      "id": "ps:9000001001",
      "imagery_date": "2019-06",
      "intersection_id": null,
      "label_date": "2019-07",
      "lat": 47.659479,
      "lng": -122.315554,
      "n_agree": 2,
      "n_disagree": 0,
      "n_unsure": 0,
      "osm_way_id": null,
      "severity": 2,
      "source_cluster_id": 9000001001,
      "street_edge_id": null,
      "tags": [],
      "type": "obstacle"
    },
    {
      "cluster_size": 1,
      "id": "ps:9000001002",
      "imagery_date": "2019-06",
      "intersection_id": null,
      "label_date": "2019-07",
      "lat": 47.661107,
      "lng": -122.3154,
      "n_agree": 1,
      "n_disagree": 0,
      "n_unsure": 0,
      "osm_way_id": null,
      "severity": 2,
      "source_cluster_id": 9000001002,
      "street_edge_id": null,
      "tags": [],
      "type": "missing_curb_ramp"
    },
    {
      "cluster_size": 1,
      "id": "ps:9000001003",
      "imagery_date": "2019-06",
      "intersection_id": null,
      "label_date": "2019-07",
      "lat": 47.66178,
      "lng": -122.315484,
      "n_agree": 3,
      "n_disagree": 0,
      "n_unsure": 0,
      "osm_way_id": null,
      "severity": null,
      "source_cluster_id": 9000001003,
      "street_edge_id": null,
      "tags": [],
      "type": "curb_ramp"
    },
    {
      "cluster_size": 1,
      "id": "ps:9000001004",
      "imagery_date": "2019-06",
      "intersection_id": null,
      "label_date": "2019-07",
      "lat": 47.663066,
      "lng": -122.314686,
      "n_agree": 0,
      "n_disagree": 0,
      "n_unsure": 0,
      "osm_way_id": null,
      "severity": 2,
      "source_cluster_id": 9000001004,
      "street_edge_id": null,
      "tags": [],
      "type": "no_sidewalk"
    },
    {
      "cluster_size": 1,
      "id": "ps:9000001005",
      "imagery_date": "2019-06",
      "intersection_id": null,
      "label_date": "2019-07",
      "lat": 47.66346,
      "lng": -122.313146,
      "n_agree": 1,
      "n_disagree": 0,
      "n_unsure": 0,
      "osm_way_id": null,
      "severity": 2,
      "source_cluster_id": 9000001005,
      "street_edge_id": null,
      "tags": [],
      "type": "obstacle"
    }
  ],
  "schema": "waymark.priors.v1",
  "source": {
    "base_url": "https://example.invalid",
    "license": "CC0-1.0",
    "name": "SYNTHETIC test priors (waymark demo)",
    "street_geometry": "none"
  }
}
